{
  "$schema": "../../certificate-template.schema.json",
  "key": "cacic-unesp/organizer",
  "name": "CACiC Unesp - Organizador",
  "description": "Certificado para organizadores",
  "html": "cacic-unesp-organizer.template.html",
  "css": "cacic-unesp-organizer.template.css",
  "font": "inter-variable",
  "certificateFields": {
    "top-text": {
      "label": "Texto em cima do nome",
      "type": "string",
      "required": true,
      "default": "Certificamos a participação de"
    },
    "bottom-text": {
      "label": "Texto embaixo do nome",
      "type": "string",
      "required": true,
      "default": "como organizador do evento"
    }
  }
}
